link,type,time_ago,headline
/news/gabriel-bonfim-leveled-up-legend-ufc-vegas-111,Athletes,4 hours ago,Gabriel Bonfim | Leveled Up By A Legend
/news/chris-padilla-blocking-out-the-noise-ufc-fight-night-bonfim-vs-brown,Athletes,5 hours ago,Chris Padilla | Blocking Out The Noise
/news/matt-schnell-honest-excited-and-dangerous-ufc-fight-night-bonfim-vs-brown,Athletes,5 hours ago,"Matt Schnell | Honest, Excited, And Dangerous"
/video/152387,Interviews,5 hours ago,Zachary Reese Fight Week Interview | UFC Fight Night…
/news/tecia-pennington-crossroad-ufc-fight-night-bonfim-vs-brown,Athletes,5 hours ago,Tecia Pennington | At A Crossroad
/news/updates-ufc-fight-night-bonfim-vs-brown,Announcements,6 hours ago,Updates To UFC Fight Night: Bonfim vs Brown
/news/uros-medic-back-track-ufc-fight-night-bonfim-vs-brown,Athletes,5 hours ago,Uroš Medić Is Back On Track
/video/152381,UFC Unfiltered,9 hours ago,"UFC Unfiltered | Gabriel Bonfim, Christian Leroy…"
/news/randy-brown-something-bigger-ufc-fight-night-vegas-111,Athletes,11 hours ago,Randy Brown | Something Bigger
/video/117692,Athletes,12 hours ago,Islam Makhachev Origins | UFC Connected
/video/152379,Interviews,12 hours ago,Donate To Randy Brown Foundation For Hurricane…
/news/very-best-ufc-nyc-205-217-268-295-322,Highlights,12 hours ago,The Very Best Of UFC In NYC
/video/152376,Interviews,1 day ago,Tecia Pennington Fight Week Interview | UFC Fight…
/video/152374,Interviews,1 day ago,Matt Schnell Fight Week Interview | UFC Fight Night:…
/video/152373,Interviews,1 day ago,Mayra Bueno Silva Fight Week Interview | UFC Fight…
/video/152372,Interviews,1 day ago,Chris Padilla Fight Week Interview | UFC Fight Night…
/news/joseph-morales-all-way-back-ufc-vegas-111-flyweight,Athletes,1 day ago,Joseph Morales | All The Way Back
/video/152369,Interviews,1 day ago,Uroš Medić Fight Week Interview | UFC Fight Night:…
/video/152366,Interviews,1 day ago,Gabriel Bonfim Fight Week Interview | UFC Fight…
/video/152359,Interviews,1 day ago,Randy Brown Fight Week Interview | UFC Fight Night:…
/video/152357,Interviews,1 day ago,Joseph Morales Fight Week Interview | UFC Fight…
/news/topps-finest-ufc-now-available-ufc-store,Licensed,1 day ago,Topps Finest UFC is Now Available at UFC Store!
/news/malcolm-wellmaker-built-ground-bantamweight-ufc-322,Athletes,1 day ago,Malcolm Wellmaker | Built From The Ground Up
/news/ufc-performance-institute-hosts-summit-american-college-sports-medicine,UFC Performance Institute,1 day ago,UFC Performance Institute Hosts Summit With American…
/news/christian-leroy-duncan-settled-and-starting-flourish-ufc-vegas-111,Athletes,1 day ago,Christian Leroy Duncan | Settled In And Starting To…
/video/152349,Interviews,1 day ago,Steve Garcia Discusses What Comes Next With Karyn…
/video/138101,Highlights,2 days ago,Zhang Weili | Best Finishes
/video/152337,UFC Unfiltered,2 days ago,"UFC Unfiltered | Valter Walker, Quillan Salkilld,…"
/news/adrian-yanez-reloaded-ufc-vegas-111,Athletes,3 weeks hence,Adrian Yanez | Reloaded
/gallery/photo-gallery-luana-santos-trains-ufc-pi,,2 days ago,Photo Gallery | Luana Santos Trains At UFC PI
/news/fighters-on-the-rise-ufc-fight-night-bonfim-vs-brown-morales-tulio-cavalcanti,Athletes,3 days ago,Fighters On The Rise | UFC Fight Night: Bonfim vs…
/video/152317,Free Fight,3 days ago,Full Fight | Gabriel Bonfim vs Trevin Giles
/video/152316,Free Fight,3 days ago,Full Fight | Randy Brown vs Muslim Salikhov
/news/fight-fight-preview-ufc-fight-night-bonfim-vs-brown-vegas-111,Fight Coverage,3 days ago,Fight By Fight Preview | UFC Fight Night: Bonfim vs…
/video/152314,Highlights,3 days ago,Jack Della Maddalena | Fight Marathon
/news/scorecard-ufc-fight-night-garcia-vs-onama,Fight Coverage,4 days ago,The Scorecard | UFC Fight Night: Garcia vs Onama
/news/ufc-fight-night-garcia-vs-onama-main-card-results-highlights-recaps-winners-interviews,Results,5 days ago,Main Card Results | UFC Fight Night: Garcia vs Onama
/video/152298,Interviews,5 days ago,Steve Garcia Post-Fight Interview | UFC Fight Night:…
/news/bonus-coverage-2025-performance-fight-of-the-night,Results,4 days ago,Bonus Coverage | UFC Fight Night: Garcia vs Onama
/video/152181,Interviews,5 days ago,Steve Garcia Octagon Interview | UFC Fight Night:…
/video/152292,Press Conference,5 days ago,Post-Fight Press Conference | UFC Fight Night:…
/video/152296,Interviews,5 days ago,Waldo Cortes Acosta Post-Fight Interview | UFC Fight…
/video/152182,Interviews,5 days ago,Waldo Cortes-Acosta Octagon Interview | UFC Fight…
/news/official-judges-scorecards-ufc-fight-night-garcia-vs-onama,Scorecards,4 days ago,Official Scorecards | UFC Fight Night: Garcia vs…
/video/152183,Interviews,5 days ago,Jeremiah Wells Octagon Interview | UFC Fight Night:…
/video/152295,Interviews,5 days ago,Jeremiah Wells Post-Fight Interview | UFC Fight…
/video/152293,Interviews,5 days ago,Yadier del Valle Post-Fight Interview | UFC Fight…
/video/152184,Interviews,5 days ago,Yadier Del Valle Octagon Interview | UFC Fight Night…
/video/152291,Interviews,5 days ago,Charles Radtke Post-Fight Interview | UFC Fight…
/video/152185,Interviews,5 days ago,Charles Radtke Octagon Interview | UFC Fight Night:…
/video/152186,Interviews,5 days ago,Allan Nascimento Octagon Interview | UFC Fight Night…
/video/152286,Interviews,5 days ago,Allan Nascimento Post-Fight Interview | UFC Fight…
/video/152285,Interviews,5 days ago,Billy Elekana Post-Fight Interview | UFC Fight Night…
/news/ufc-fight-night-garcia-vs-onama-prelim-results-highlights-recaps-winners-interviews,Results,4 days ago,Prelim Results | UFC Fight Night: Garcia vs Onama
/video/152284,Interviews,5 days ago,Timmy Cuamba Post-Fight Interview | UFC Fight Night:…
/video/152281,Interviews,5 days ago,Donte Johnson Post-Fight Interview | UFC Fight Night…
/video/152282,Highlights,5 days ago,Billy Elekana Submits Christian | UFC Fight Night:…
/video/152280,Interviews,5 days ago,Norma Dumont Post-Fight Interview | UFC Fight Night:…
/video/152278,Interviews,5 days ago,Alice Ardelean Post-Fight Interview | UFC Fight…
/video/152276,Interviews,5 days ago,Seokhyeon Ko Post-Fight Interview | UFC Fight Night:…
/video/152274,Interviews,5 days ago,Talita Alencar Post-Fight Interview | UFC Fight…
/video/152273,Highlights,5 days ago,Talita Alencar Submits Carnelossi | UFC Fight Night:…
/news/fight-by-fight-preview-ufc-fight-night-garcia-vs-onama,Fight Coverage,5 days ago,UFC Tonight: Fight By Fight Preview | UFC Fight…
/video/152271,UFC Unfiltered,6 days ago,"UFC Unfiltered | Steve Garcia, Jeremiah Wells &…"
/news/yadier-del-valle-no-fear-ufc-vegas-110,Athletes,6 days ago,Yadier del Valle | No Fear
/video/152260,Fight Coverage,6 days ago,Two Titles On The Line In New York City | UFC 322:…
/video/152225,Power Slap,6 days ago,Power Slap 17: Blackburn vs Young 2 | Full Event
/video/152255,Weigh-in,6 days ago,Weigh-In Highlights | UFC Fight Night: Garcia vs…
/news/official-weigh-results-ufc-fight-night-garcia-vs-onama-vegas-110,Weigh-in,6 days ago,Official Weigh-In Results | UFC Fight Night: Garcia…
/news/themba-gorimbo-welcome-to-the-mamba-show-ufc-vegas-110,Athletes,6 days ago,Themba Gorimbo: ‘Welcome To The Mamba Show’
/news/the-tao-of-allan-nascimento-ufc-vegas-110,Athletes,1 week ago,The Tao Of Allan Nascimento
/news/phil-rowe-tired-of-fighting-himself-ufc-vegas-110,Athletes,1 week ago,Phil Rowe | Tired of Fighting Himself
/news/waldo-cortes-acosta-be-more-waldo-ufc-vegas-110,Athletes,1 week ago,Waldo Cortes Acosta | Be More Waldo
/news/alice-ardelean-is-planning-her-big-move-ufc-vegas-110,Athletes,1 week ago,Alice Ardelean Is Planning Her Big Move
/news/ante-delija-making-waves,Athletes,1 week ago,Ante Delija | Making Waves
/news/ketlen-vieira-ready-claim-title-ufc-vegas-110,Athletes,1 week ago,Ketlen Vieira Is Ready To Claim Her Title Shot
/video/152208,Interviews,1 week ago,Alice Ardelean Fight Week interview | UFC Fight…
/video/152207,Interviews,1 week ago,Ketlen Vieira Fight Week interview | UFC Fight Night…
/video/152205,Interviews,1 week ago,Waldo Cortes Acosta Fight Week interview | UFC Fight…
/video/152204,Interviews,1 week ago,Steve Garcia Fight Week interview | UFC Fight Night:…
/news/norma-dumont-done-waiting-around-ufc-fight-night-garcia-vs-onama,Athletes,1 week ago,Norma Dumont Is Done Waiting Around
/video/152202,Dana White's Contender Series,1 week ago,Six Great Fights From Dana White's Contender Series…
/news/david-onama-excited-but-also-expected-vegas-110,Athletes,1 week ago,"David Onama | Excited, But Also Expected"
/news/guayaquil-launch-free-mma-schools-inspired-legacy-luna-martinetti-brothers,Special Feature,1 week ago,Guayaquil to Launch Free MMA Schools Inspired by the…
/video/152200,Interviews,1 week ago,Themba Gorimbo Fight Week interview | UFC Fight…
/video/152198,Interviews,1 week ago,Norma Dumont Fight Week interview | UFC Fight Night:…
/video/152196,Interviews,1 week ago,Ante Delija Fight Week interview | UFC Fight Night:…
/news/donte-johnson-clocking-in-ufc-vegas-110,Athletes,1 week ago,Donte Johnson | Clocking In
/video/152195,Interviews,1 week ago,David Onama Fight Week interview | UFC Fight Night:…
/news/10-get-ready-for-a-november-to-remember-inside-octagon-ufc,Athletes,1 week ago,The 10 | Get Ready For A November To Remember Inside…
/news/texas-precious-metals-unveils-official-ufc-silver-round-collection,Licensed,1 week ago,Texas Precious Metals Unveils Official UFC Silver…
/news/ufc-speed-bag-capsules-now-available-walmart-usa,Licensed,1 week ago,UFC Speed Bag Capsules Now Available at Walmart USA
/video/152153,UFC Unfiltered,1 week ago,UFC Unfiltered | Charles Jourdain Talks Vancouver…
/news/ufc-expands-partnership-youth-charity-onside-launch-mental-health-programme-wirral,UFC Foundation,1 week ago,UFC Expands Partnership With Youth Charity Onside To…
/news/fighters-rise-ufc-fight-night-garcia-vs-onama-delija-nascimento-dumont,Athletes,1 week ago,Fighters On The Rise | UFC Fight Night: Garcia vs…
/news/ufc-australia-paramount-faq,,1 week ago,UFC Australia on Paramount+ FAQ
/video/152137,Announcements,1 week ago,UFC on Paramount+ Australia
/news/steve-garcia-real-recognizes-real-ufc-fight-night-vegas-110,Athletes,1 week ago,Steve Garcia | Real Recognizes Real
/news/paramount-and-ufc-expand-partnership-australia,,1 week ago,PARAMOUNT AND UFC EXPAND PARTNERSHIP TO AUSTRALIA
/news/paramount-and-ufc-expand-partnership-to-latin-america-and-australia-starting-in-2026,Announcements,1 week ago,Paramount And UFC Expand Partnership To Latin…
/news/2025-topps-now-ufc,Licensed,1 week ago,2025 Topps Now | UFC 321
/video/152127,Fight Pass Preview,1 week ago,Full Fight | David Onama vs Gabriel Benitez
/video/152128,Fight Pass Preview,1 week ago,Full Fight | Steve Garcia vs Kyle Nelson
/news/monthly-report-october-2025-ufc-jourdain-oliveira-salkilld-dober,Athletes,1 week ago,Monthly Report | October 2025
/news/bigger-picture-ufc-321-aspinall-vs-gane,Fight Coverage,1 week ago,The Bigger Picture | UFC 321: Aspinall vs Gane
/video/152108,Podcast,1 week ago,About Last Fight | Mackenzie Dern goes from jiu…
/video/152102,Press Conference,1 week ago,Ciryl Gane Post-Fight Press Conference | UFC 321
/video/152101,Press Conference,1 week ago,Dana White Post-Fight Press Conference | UFC 321
/video/152103,Press Conference,1 week ago,Mackenzie Dern Post-Fight Press Conference | UFC 321
/video/152100,Press Conference,1 week ago,Umar Nurmagomedov Post-Fight Press Conference | UFC…
/news/ufc-321-aspinall-vs-gane-event-tonight-main-card-live-results-recaps-highlights-interviews-abu-dhabi,Results,1 week ago,Main Card Results | UFC 321: Aspinall vs Gane
/video/152082,Press Conference,1 week ago,Post-Fight Press Conference | UFC 321: Aspinall vs…
/news/official-judges-scorecards-ufc-321-aspinall-vs-gane,Scorecards,1 week ago,Official Scorecards | UFC 321: Aspinall vs Gane
/video/152096,Interviews,1 week ago,Mackenzie Dern Post-Fight Interview | UFC 321
/video/152040,Interviews,1 week ago,Mackenzie Dern Octagon Interview | UFC 321
/video/152090,Interviews,1 week ago,Umar Nurmagomedov Post-Fight Interview | UFC 321
/video/152041,Interviews,1 week ago,Umar Nurmagomedov Octagon Interview | UFC 321
/video/152087,Interviews,1 week ago,Alexander Volkov Post-Fight Interview | UFC 321
/video/152042,Interviews,1 week ago,Alexander Volkov Octagon Interview | UFC 321
/video/152043,Interviews,1 week ago,Azamat Murzakanov Octagon Interview | UFC 321
/video/152031,Interviews,1 week ago,Quillan Salkilld Post-Fight Interview | UFC 321
/video/152085,Interviews,1 week ago,Azamat Murzakanov Post-Fight Interview | UFC 321
/news/ufc-321-aspinall-vs-gane-event-tonight-prelim-live-results-recaps-highlights-interviews-abu-dhabi,Results,1 week ago,Prelim Results | UFC 321: Aspinall vs Gane
/video/152032,Interviews,1 week ago,Ikram Aliskerov Post-Fight Interview | UFC 321
/video/152083,Interviews,1 week ago,Ludovit Klein Octagon Interview | UFC 321
/video/152034,Interviews,1 week ago,Valter Walker Post-Fight Interview | UFC 321
/video/152035,Interviews,1 week ago,Nathaniel Wood Post-Fight Interview | UFC 321
/video/152036,Interviews,1 week ago,Hamdy Abdelwahab Post-Fight Interview | UFC 321
/video/152037,Interviews,1 week ago,Mitch Raposo Post-Fight Interview | UFC 321
/news/fight-by-fight-preview-ufc-321-aspinall-vs-gane-abu-dhabi,Fight Coverage,1 week ago,UFC Today: Fight By Fight Preview | UFC 321:…
/news/junyong-park-hungry-for-more-ufc-321,Athletes,1 week ago,Junyong Park | Hungry For More
/video/152076,Embedded,1 week ago,UFC 321 Embedded | Episode 6
/news/ufc-partners-canucks-kids-fund-raise-more-105000-cad-benefit-local-charities-part-fight-week,UFC Foundation,1 week ago,UFC Partners with Canucks for Kids Fund to Raise…
/video/152072,Embedded,1 week ago,UFC 321 Embedded | Episode 5
/video/152070,Interviews,1 week ago,Mackenzie Dern Talks With John Gooden | UFC 321
/video/152069,Interviews,1 week ago,Ciryl Gane Talks With John Gooden | UFC 321
/video/152067,Interviews,1 week ago,Tom Aspinall Talks With John Gooden | UFC 321
/news/seriously-do-not-blink-when-tom-aspinall-and-ciryl-gane-fight-at-ufc-321,Athletes,1 week ago,Seriously: Do Not Blink When Tom Aspinall And Ciryl…
/video/152054,Power Slap,1 week ago,Power Slap 16: Wolverine vs Klingbeil | Full Event
